job_id,problem_id,problem_uuid,num_attempts,score_mean,score_max,score_min,score_median,score_stdev,created_at_first,created_at_last,num_oscillating,rubric_json,rubric_count,download_status,status,qa_result,qa_notes,processed_at
22803ea0-5a98-428c-aa2c-b2cb47e46938,pymc-devs__pytensor-03,153f4e55-e1f0-4e46-a905-5fbdd0f3e147,5,0.554,0.63,0.38,0.63,0.1123832727766904,2026-02-24T07:19:22.421123Z,2026-02-24T07:19:22.421123Z,3,"[{""criterion"": ""Identifies the bug in pytensor/tensor/pad.py in the _get_edges function where the right edge slice reads one position past the last valid data element into the padding area, so edge-based padding modes (edge, reflect, symmetric) use a padding value instead of the true rightmost data value"", ""weight"": 1.0}, {""criterion"": ""Identifies the bug in pytensor/scan/op.py in the Scan.perform method where the circular buffer tap index has an off-by-one error, causing scan to read from the wrong time step when accessing previous outputs via taps, producing incorrect results for multi-tap recurrences like Fibonacci-style sequences"", ""weight"": 1.0}, {""criterion"": ""Identifies the bug in pytensor/tensor/einsum.py in the _general_dot function where the batch axis counting comparison is inverted \u2014 it counts batch axes to the LEFT of the contraction axis (batch_axis < var_axis) instead of to the RIGHT (batch_axis > var_axis), so the variable batch_axes_to_the_right actually holds the wrong count. After moveaxis moves batch axes to front positions, contraction axes that had batch axes originally to their right need their index increased by that count, but the wrong count produces incorrect contraction axis indices for batched einsum operations"", ""weight"": 1.0}, {""criterion"": ""Identifies the bug in pytensor/tensor/basic.py in the triu function where it computes 1 - tri(..., k=k+1) but the correct upper-triangular identity is triu(m, k) = m * (1 - tri(..., k=k-1)), since tri(k-1) has ones at and below diagonal k-1 and subtracting from 1 gives ones at diagonal k and above \u2014 using k+1 instead of k-1 zeros out two extra diagonals, so triu(m, 0) would lose both the main diagonal and the first superdiagonal"", ""weight"": 1.0}, {""criterion"": ""Identifies the bug in pytensor/scalar/basic.py in the Clip.L_op method where the upper-bound gradient passthrough condition uses strict inequality (x < mx) instead of non-strict (x <= mx), causing the gradient to be zero when the input exactly equals the max clip boundary instead of correctly passing the gradient through"", ""weight"": 1.0}, {""criterion"": ""Identifies the bug in pytensor/tensor/math.py in the tensordot function where transpose_axes_a puts the summed (contracted) axes first and non-summed axes last, but the immediately following reshape uses (non_summed_size_a, summed_size_a) which expects non-summed data in the leading positions \u2014 this mismatch causes the flattened matrix to have summed elements where non-summed elements should be, producing incorrect dot product results for any tensordot where a has both summed and non-summed axes"", ""weight"": 1.0}, {""criterion"": ""Identifies the bug in pytensor/tensor/basic.py in the Join.L_op method (around line 2690) where specify_broadcastable is called with axes where s != 1 (non-unit dimensions), but specify_broadcastable marks the given axes as broadcastable (size 1), so the condition should be s == 1 to select the actual broadcastable axes. The comment above states 'Split.make_node isn't always able to infer the right broadcast' confirming the intent is to restore broadcastability on size-1 axes, and the correct pattern is visible elsewhere in the same file (around line 3081) where axes with shape == 1 are passed to specify_broadcastable. Using s != 1 inverts the logic, marking large dimensions as broadcastable and leaving true size-1 dimensions unmarked"", ""weight"": 1.0}, {""criterion"": ""Identifies the bug in pytensor/tensor/basic.py in the Alloc.grad method where the gradient shape comparison examines the first N dimensions instead of the last N dimensions, causing incorrect broadcast axis detection when Alloc adds leading dimensions, resulting in wrong gradient reduction axes"", ""weight"": 1.0}]",8,,,,,
ff611d5d-3882-48d3-9c27-4629785d4d1b,pymodbus-dev__pymodbus-05,639e5bb7-757d-45ff-85fb-1ac552b364fe,5,0.552,0.63,0.48,0.55,0.06379655163094633,2026-02-25T05:11:49.517623Z,2026-02-25T05:11:49.517623Z,4,"[{""criterion"": ""In file pymodbus/client/mixin.py, in the ModbusClientMixin.convert_from_registers() method around line 726-728, the validation check for register count being a multiple of data_len is missing. The code should have 'if (reg_len := len(registers)) % data_len:' to raise an exception when register count doesn't match data type size, but this validation block has been removed. This bug causes incorrect unpacking when register count doesn't match data type size, leading to wrong values or IndexError."", ""weight"": 1.0}, {""criterion"": ""In file pymodbus/client/mixin.py, in the ModbusClientMixin.convert_to_registers() method around line 768-769, the padding for odd-length byte arrays is missing. The code should have 'if len(byte_list) % 2: byte_list += b\""\\x00\""' to pad odd-length byte arrays, but this padding block has been removed. This bug causes odd-length byte arrays to fail or produce incorrect results when splitting into 2-byte registers."", ""weight"": 1.0}, {""criterion"": ""In file pymodbus/datastore/context.py, in the ModbusDeviceContext.async_getValues() method around line 84, there is an off-by-one error in address translation. The code has 'address = address' instead of 'address += 1', removing the increment that converts 0-based addresses to 1-based. This bug causes all reads from address 0 to read from address 1 instead, causing systematic offset in all read operations."", ""weight"": 1.0}, {""criterion"": ""In file pymodbus/client/base.py, in the ModbusBaseClient.connect() method around line 61, there is incorrect connection timing. The code has 'await asyncio.sleep(0.1)' before 'rc = await self.ctx.connect()', causing an unnecessary delay before connection attempts. This bug introduces a 100ms delay before every connection attempt, which can cause timeout issues in time-sensitive scenarios and makes connection establishment slower than necessary."", ""weight"": 1.0}, {""criterion"": ""In file pymodbus/pdu/decoders.py, in the DecodePDU.decode() method around line 64, there is incorrect exception code extraction. The code has 'pdu_exp = ExceptionResponse((function_code & 0x7F) - 1)' instead of 'pdu_exp = ExceptionResponse(function_code & 0x7F)', subtracting 1 from the masked function code. This bug causes exception codes to be misinterpreted when decoding exception responses."", ""weight"": 1.0}, {""criterion"": ""In file pymodbus/client/serial.py, in the ModbusSerialClient.send() method around line 266, there is a missing check for write result. The code has 'size = self.socket.write(request)' followed by 'if size is None:' without the walrus operator, removing the combined assignment and check. This bug causes silent failure if write() returns None, appearing as 0 bytes sent instead of raising an error."", ""weight"": 1.0}, {""criterion"": ""In file pymodbus/client/serial.py, in the ModbusSerialClient._t0 calculation around line 209, there is incorrect byte time calculation. The code has 'self._t0 = float(1 + bytesize + stopbits + 1) / baudrate' instead of 'self._t0 = float(1 + bytesize + stopbits) / baudrate', adding an extra 1 for start bit. This bug causes timing calculations to be slightly off, potentially causing race conditions in serial operations."", ""weight"": 1.0}, {""criterion"": ""In file pymodbus/client/tcp.py, in the ModbusTcpClient.recv() method around line 277, there is an off-by-one error in size calculation. The code has 'recv_size = size - data_length - 1' instead of 'recv_size = size - data_length', causing the last chunk to request one byte too few. This bug causes potential for reading incomplete data or timeout issues with fragmented responses."", ""weight"": 1.0}, {""criterion"": ""In file pymodbus/pdu/pdu.py, in the ModbusPDU.calculateRtuFrameSize() method around line 106, there is an off-by-one error in frame size calculation. The code has 'return int(data[cls.rtu_byte_count_pos]) + cls.rtu_byte_count_pos + 2' instead of 'return int(data[cls.rtu_byte_count_pos]) + cls.rtu_byte_count_pos + 3', causing frame size to be underestimated by 1. This bug causes potential for reading incomplete frames or timeout issues."", ""weight"": 1.0}, {""criterion"": ""In file pymodbus/pdu/pdu.py, in the unpack_bitstring() function around line 155, there is incorrect bit extraction order. The code has bit mask order as '(128, 64, 32, 16, 8, 4, 2, 1)' instead of '(1, 2, 4, 8, 16, 32, 64, 128)', causing bits to be extracted in reverse order within each byte. This bug causes bits to be extracted in reverse order, affecting all bit unpacking operations."", ""weight"": 1.0}, {""criterion"": ""In file pymodbus/framer/base.py, in the FramerBase.handleFrame() method around line 82, there is missing transaction ID validation. The code has 'if exp_tid and tid != exp_tid:' instead of 'if exp_tid and tid and tid != exp_tid:', removing the 'tid and' check. This bug causes transaction ID 0 to not be validated, allowing mismatched responses when tid is 0."", ""weight"": 1.0}, {""criterion"": ""In file pymodbus/datastore/context.py, in the ModbusServerContext.__get_device() method around line 134, there is incorrect fallback logic. The code has 'if 0 in self._devices:' without checking if device_id is 0, causing fallback to device 0 even when requesting non-existent non-zero device IDs. This bug causes requests for non-existent device IDs to incorrectly get device 0's context, potentially masking configuration errors."", ""weight"": 1.0}, {""criterion"": ""In file pymodbus/datastore/context.py, in the ModbusBaseDeviceContext.decode() method around line 26, the function code mapping returns None for unknown function codes instead of a default string. The code has 'return self._fx_mapper.get(fx, None)' which returns None for unmapped function codes. However, the store dictionary lookup expects a string key, and when None is used as a key, it causes KeyError when accessing self.store[store_key], breaking datastore lookups for unknown function codes."", ""weight"": 1.0}, {""criterion"": ""In file pymodbus/framer/base.py, in the FramerBase.buildFrame() method around line 62, the function code is encoded using little-endian byte order instead of big-endian. The code has 'message.function_code.to_bytes(1,'little')' which uses little-endian. However, Modbus protocol uses big-endian (network byte order) for all fields, so it should be 'message.function_code.to_bytes(1,'big')'. This bug violates protocol conventions and can cause interoperability issues with strict Modbus implementations."", ""weight"": 1.0}, {""criterion"": ""In file pymodbus/client/mixin.py, in the ModbusClientMixin.readwrite_registers() method around line 628, the address parameter handling is incomplete. The code has 'if address: read_address = address' which only sets read_address when address is provided, but does not set write_address. The missing 'write_address = address' line causes write_address to remain at its default value (0) even when address is specified, leading to incorrect write operations that write to address 0 instead of the intended address."", ""weight"": 1.0}, {""criterion"": ""In file pymodbus/client/mixin.py, in the ModbusClientMixin.readwrite_registers() method around line 624, there is incorrect default value handling. The code has 'if values is None:' instead of 'if not values:', causing empty list [] to be silently accepted when it should error. This bug causes empty list for values to be silently accepted when it should raise an error."", ""weight"": 1.0}, {""criterion"": ""In file pymodbus/pdu/pdu.py, in the ModbusPDU.verifyAddress() method around line 59, the error message uses misleading comparison operators. The code has 'raise ValueError(f\""0 <= address {address} <= 65535 !\"")' which shows '0 <=' in the message, but the message format is misleading because it suggests the address is valid when it's actually out of range. The error message should clearly indicate the address is out of the valid range [0, 65535], making debugging more difficult."", ""weight"": 1.0}, {""criterion"": ""In file pymodbus/datastore/context.py, in the ModbusDeviceContext.async_getValues() method around line 87, there is incorrect validation for the count parameter. The code has 'if count <= 0: return ExcCodes.ILLEGAL_ADDRESS' which validates count but returns the wrong error code (ILLEGAL_ADDRESS instead of ILLEGAL_VALUE) and validates after address translation. The validation should happen before any processing, and should return a more appropriate error code or raise an exception for invalid count values."", ""weight"": 1.0}, {""criterion"": ""In file pymodbus/pdu/pdu.py, in the ModbusPDU.verifyCount() method around line 50, there is incorrect lower bound. The code has 'if not 0 <= count <= max_count:' instead of 'if not 1 <= count <= max_count:', allowing count=0 which is not valid in Modbus protocol. This bug causes invalid count=0 requests to be accepted, leading to empty responses or protocol violations."", ""weight"": 1.0}, {""criterion"": ""In file pymodbus/client/mixin.py, in the ModbusClientMixin.convert_to_registers() method around line 760, there is incorrect padding calculation for bit strings. The code has 'if (missing := len(value) % 16): value = value + [False] * missing' instead of 'if (missing := len(value) % 16): value = value + [False] * (16 - missing)', adding insufficient padding. This bug causes insufficient padding when bit count is not multiple of 16, causing incorrect register conversion."", ""weight"": 1.0}]",20,,,,,
74e0dfd2-c4ae-4bc3-9129-213514bb6cc1,pymodbus-dev__pymodbus-05,f9e4070c-6b3e-4474-a68f-14818ed7a55e,5,0.594,0.63,0.53,0.6,0.04159326868617084,2026-02-24T22:50:19.546358Z,2026-02-24T22:50:19.546358Z,3,"[{""criterion"": ""In file pymodbus/client/mixin.py, in the ModbusClientMixin.convert_from_registers() method around line 726-728, the validation check for register count being a multiple of data_len is missing. The code should have 'if (reg_len := len(registers)) % data_len:' to raise an exception when register count doesn't match data type size, but this validation block has been removed. This bug causes incorrect unpacking when register count doesn't match data type size, leading to wrong values or IndexError."", ""weight"": 1.0}, {""criterion"": ""In file pymodbus/client/mixin.py, in the ModbusClientMixin.convert_to_registers() method around line 768-769, the padding for odd-length byte arrays is missing. The code should have 'if len(byte_list) % 2: byte_list += b\""\\x00\""' to pad odd-length byte arrays, but this padding block has been removed. This bug causes odd-length byte arrays to fail or produce incorrect results when splitting into 2-byte registers."", ""weight"": 1.0}, {""criterion"": ""In file pymodbus/datastore/context.py, in the ModbusDeviceContext.async_getValues() method around line 84, there is an off-by-one error in address translation. The code has 'address = address' instead of 'address += 1', removing the increment that converts 0-based addresses to 1-based. This bug causes all reads from address 0 to read from address 1 instead, causing systematic offset in all read operations."", ""weight"": 1.0}, {""criterion"": ""In file pymodbus/client/base.py, in the ModbusBaseClient.connect() method around line 61, there is incorrect connection timing. The code has 'await asyncio.sleep(0.1)' before 'rc = await self.ctx.connect()', causing an unnecessary delay before connection attempts. This bug introduces a 100ms delay before every connection attempt, which can cause timeout issues in time-sensitive scenarios and makes connection establishment slower than necessary."", ""weight"": 1.0}, {""criterion"": ""In file pymodbus/pdu/decoders.py, in the DecodePDU.decode() method around line 64, there is incorrect exception code extraction. The code has 'pdu_exp = ExceptionResponse((function_code & 0x7F) - 1)' instead of 'pdu_exp = ExceptionResponse(function_code & 0x7F)', subtracting 1 from the masked function code. This bug causes exception codes to be misinterpreted when decoding exception responses."", ""weight"": 1.0}, {""criterion"": ""In file pymodbus/client/serial.py, in the ModbusSerialClient.send() method around line 266, there is a missing check for write result. The code has 'size = self.socket.write(request)' followed by 'if size is None:' without the walrus operator, removing the combined assignment and check. This bug causes silent failure if write() returns None, appearing as 0 bytes sent instead of raising an error."", ""weight"": 1.0}, {""criterion"": ""In file pymodbus/client/serial.py, in the ModbusSerialClient._t0 calculation around line 209, there is incorrect byte time calculation. The code has 'self._t0 = float(1 + bytesize + stopbits + 1) / baudrate' instead of 'self._t0 = float(1 + bytesize + stopbits) / baudrate', adding an extra 1 for start bit. This bug causes timing calculations to be slightly off, potentially causing race conditions in serial operations."", ""weight"": 1.0}, {""criterion"": ""In file pymodbus/client/tcp.py, in the ModbusTcpClient.recv() method around line 277, there is an off-by-one error in size calculation. The code has 'recv_size = size - data_length - 1' instead of 'recv_size = size - data_length', causing the last chunk to request one byte too few. This bug causes potential for reading incomplete data or timeout issues with fragmented responses."", ""weight"": 1.0}, {""criterion"": ""In file pymodbus/pdu/pdu.py, in the ModbusPDU.calculateRtuFrameSize() method around line 106, there is an off-by-one error in frame size calculation. The code has 'return int(data[cls.rtu_byte_count_pos]) + cls.rtu_byte_count_pos + 2' instead of 'return int(data[cls.rtu_byte_count_pos]) + cls.rtu_byte_count_pos + 3', causing frame size to be underestimated by 1. This bug causes potential for reading incomplete frames or timeout issues."", ""weight"": 1.0}, {""criterion"": ""In file pymodbus/pdu/pdu.py, in the unpack_bitstring() function around line 155, there is incorrect bit extraction order. The code has bit mask order as '(128, 64, 32, 16, 8, 4, 2, 1)' instead of '(1, 2, 4, 8, 16, 32, 64, 128)', causing bits to be extracted in reverse order within each byte. This bug causes bits to be extracted in reverse order, affecting all bit unpacking operations."", ""weight"": 1.0}, {""criterion"": ""In file pymodbus/framer/base.py, in the FramerBase.handleFrame() method around line 82, there is missing transaction ID validation. The code has 'if exp_tid and tid != exp_tid:' instead of 'if exp_tid and tid and tid != exp_tid:', removing the 'tid and' check. This bug causes transaction ID 0 to not be validated, allowing mismatched responses when tid is 0."", ""weight"": 1.0}, {""criterion"": ""In file pymodbus/datastore/context.py, in the ModbusServerContext.__get_device() method around line 134, there is incorrect fallback logic. The code has 'if 0 in self._devices:' without checking if device_id is 0, causing fallback to device 0 even when requesting non-existent non-zero device IDs. This bug causes requests for non-existent device IDs to incorrectly get device 0's context, potentially masking configuration errors."", ""weight"": 1.0}, {""criterion"": ""In file pymodbus/datastore/context.py, in the ModbusBaseDeviceContext.decode() method around line 26, the function code mapping returns None for unknown function codes instead of a default string. The code has 'return self._fx_mapper.get(fx, None)' which returns None for unmapped function codes. However, the store dictionary lookup expects a string key, and when None is used as a key, it causes KeyError when accessing self.store[store_key], breaking datastore lookups for unknown function codes."", ""weight"": 1.0}, {""criterion"": ""In file pymodbus/framer/base.py, in the FramerBase.buildFrame() method around line 62, the function code is encoded using little-endian byte order instead of big-endian. The code has 'message.function_code.to_bytes(1,'little')' which uses little-endian. However, Modbus protocol uses big-endian (network byte order) for all fields, so it should be 'message.function_code.to_bytes(1,'big')'. This bug violates protocol conventions and can cause interoperability issues with strict Modbus implementations."", ""weight"": 1.0}, {""criterion"": ""In file pymodbus/client/mixin.py, in the ModbusClientMixin.readwrite_registers() method around line 628, the address parameter handling is incomplete. The code has 'if address: read_address = address' which only sets read_address when address is provided, but does not set write_address. The missing 'write_address = address' line causes write_address to remain at its default value (0) even when address is specified, leading to incorrect write operations that write to address 0 instead of the intended address."", ""weight"": 1.0}, {""criterion"": ""In file pymodbus/client/mixin.py, in the ModbusClientMixin.readwrite_registers() method around line 624, there is incorrect default value handling. The code has 'if values is None:' instead of 'if not values:', causing empty list [] to be silently accepted when it should error. This bug causes empty list for values to be silently accepted when it should raise an error."", ""weight"": 1.0}, {""criterion"": ""In file pymodbus/pdu/pdu.py, in the ModbusPDU.verifyAddress() method around line 59, the error message uses misleading comparison operators. The code has 'raise ValueError(f\""0 <= address {address} <= 65535 !\"")' which shows '0 <=' in the message, but the message format is misleading because it suggests the address is valid when it's actually out of range. The error message should clearly indicate the address is out of the valid range [0, 65535], making debugging more difficult."", ""weight"": 1.0}, {""criterion"": ""In file pymodbus/datastore/context.py, in the ModbusDeviceContext.async_getValues() method around line 87, there is incorrect validation for the count parameter. The code has 'if count <= 0: return ExcCodes.ILLEGAL_ADDRESS' which validates count but returns the wrong error code (ILLEGAL_ADDRESS instead of ILLEGAL_VALUE) and validates after address translation. The validation should happen before any processing, and should return a more appropriate error code or raise an exception for invalid count values."", ""weight"": 1.0}, {""criterion"": ""In file pymodbus/pdu/pdu.py, in the ModbusPDU.verifyCount() method around line 50, there is incorrect lower bound. The code has 'if not 0 <= count <= max_count:' instead of 'if not 1 <= count <= max_count:', allowing count=0 which is not valid in Modbus protocol. This bug causes invalid count=0 requests to be accepted, leading to empty responses or protocol violations."", ""weight"": 1.0}, {""criterion"": ""In file pymodbus/client/mixin.py, in the ModbusClientMixin.convert_to_registers() method around line 760, there is incorrect padding calculation for bit strings. The code has 'if (missing := len(value) % 16): value = value + [False] * missing' instead of 'if (missing := len(value) % 16): value = value + [False] * (16 - missing)', adding insufficient padding. This bug causes insufficient padding when bit count is not multiple of 16, causing incorrect register conversion."", ""weight"": 1.0}]",20,,,,,
