job_id,problem_id,problem_uuid,num_attempts,score_mean,score_max,score_min,score_median,score_stdev,created_at_first,created_at_last,num_oscillating,rubric_json,rubric_count,download_status,status,qa_result,qa_notes,processed_at
ce60aafe-5921-4465-8e4e-717cd51781c6,gdsfactory__gdsfactory-01,807181ab-1f50-408c-8ce6-629b634d82d5,5,0.64,0.75,0.5,0.63,0.09273618495495703,2026-02-24T18:04:07.613735Z,2026-02-24T18:04:07.613735Z,3,"[{""criterion"": ""Identifies that in gdsfactory/components/analog/inductors.py in the inductor path_points loop the else branch appends coordinates with x and y swapped (e.g. (y, x) instead of (x, y)) so the outer octagon points are geometrically wrong and the inductor shape is asymmetric or broken on one side"", ""weight"": 1.0}, {""criterion"": ""Identifies that in gdsfactory/components/analog/inductors.py in inductor_min_diameter the multiplier of width in the minimum diameter formula is 3 instead of the correct factor (e.g. 4), so min_d is underestimated and the inductor may violate minimum diameter or use wrong grid rounding"", ""weight"": 1.0}, {""criterion"": ""Identifies that in gdsfactory/components/analog/interdigital_capacitor.py in points_1 the iteration uses floor(fingers/2) instead of ceil(fingers/2) so one pair of fingers is skipped for odd fingers and the capacitor has wrong number of finger segments"", ""weight"": 1.0}, {""criterion"": ""Identifies that in gdsfactory/components/analog/interdigital_capacitor.py in points_2 one of the vertical position expressions uses (1+2*i)*thickness instead of (2+2*i)*thickness (or equivalent) so one set of fingers is misaligned and the capacitor is asymmetric or shorted"", ""weight"": 1.0}, {""criterion"": ""Identifies that in gdsfactory/components/analog/microstrip.py in _G_integrand the argument to sqrt is (1 + xip**2) instead of (1 - xip**2), causing the integrand to be out of domain or wrong and leading to incorrect G values or possible numerical issues"", ""weight"": 1.0}, {""criterion"": ""Identifies that in gdsfactory/components/analog/microstrip.py in _microstrip_Z one of the Hammerstad formula constants (e.g. 52 or 18.1) is changed (e.g. to 51 or 18.2) so eps_eff and impedance Z are slightly wrong compared to the reference"", ""weight"": 1.0}, {""criterion"": ""Identifies that in gdsfactory/components/analog/microstrip.py in _find_microstrip_wire_width the initial guess x0 is set to 0 (or a very large value) instead of dielectric_thickness so the optimizer may converge to a wrong or invalid wire width"", ""weight"": 1.0}, {""criterion"": ""Identifies that in gdsfactory/components/bends/bend_circular.py in _bend_circular the branch that handles layer-only (no width) incorrectly passes width=0 (or otherwise wrong width) to get_cross_section so the bend is drawn with wrong width when only layer is specified"", ""weight"": 1.0}]",8,,,,,
cd894349-02c6-4f8c-b280-a09ac31cca12,gdsfactory__gdsfactory-05,50a9b9b9-47c1-4f9c-b4f2-aa4cfb1235fc,5,0.416,0.63,0.25,0.38,0.13831124321616084,2026-02-25T14:30:06.154652Z,2026-02-25T14:30:06.154652Z,4,"[{""criterion"": ""Identifies the swapped dx/dy info metadata in bend_circular_heater function in bends/bend_circular_heater.py where info['dx'] uses y-coordinates and info['dy'] uses x-coordinates (both originally use x-coordinates on lines 60-61)"", ""weight"": 1.0}, {""criterion"": ""Identifies the wrong divisor in the per-tooth period calculation in grating_coupler_elliptical function in grating_couplers/grating_coupler_elliptical.py where p = xi / (period + grating_line_width) is used instead of p = xi / period"", ""weight"": 1.0}, {""criterion"": ""Identifies the port center position using last grating reference xmin instead of x in grating_coupler_rectangular function in grating_couplers/grating_coupler_rectangular.py"", ""weight"": 1.0}, {""criterion"": ""Identifies the wrong centering formula in grating_coupler_array function in grating_couplers/grating_coupler_array.py where (i - n/2) is used instead of (i - (n-1)/2) for even n"", ""weight"": 1.0}, {""criterion"": ""Identifies the ceil vs floor change in grid count calculation in grating_coupler_dual_pol function in grating_couplers/grating_coupler_dual_pol.py adding an extra column of unit cells beyond x_span"", ""weight"": 1.0}, {""criterion"": ""Identifies the wrong output port y-offset sign in mmi1x2 function in mmis/mmi1x2.py where a = gap_mmi/2 - width_taper/2 moves ports too close together"", ""weight"": 1.0}, {""criterion"": ""Identifies the wrong port spacing formula in mmi function in mmis/mmi.py where wg_spacing_input uses width_taper/2 instead of width_taper causing input tapers to be too close"", ""weight"": 1.0}, {""criterion"": ""Identifies the wrong angle constant (40 instead of 45 degrees) in via_stack_corner45 function in vias/via_stack.py slightly changing the 45-degree corner width calculation"", ""weight"": 1.0}]",8,,,,,
b7ba9723-bc1c-4daa-b3ef-868470d5fedf,getsentry__sentry-python-01,d27af5cc-cd1a-4122-92da-6123afca8a55,5,0.538,0.58,0.48,0.55,0.037013511046643494,2026-02-25T19:33:33.345837Z,2026-02-25T19:33:33.345837Z,5,"[{""criterion"": ""Identifies the wrong variable reference in get_event in sentry_sdk/envelope.py where items.get_event() is used instead of item.get_event() while iterating with for item in self.items, causing NameError when retrieving events from envelope items"", ""weight"": 1.0}, {""criterion"": ""Identifies the boundary condition error in add_breadcrumb in sentry_sdk/scope.py where >= is used instead of > in while len(self._breadcrumbs) >= max_breadcrumbs, causing one extra breadcrumb to be removed when exactly at the limit"", ""weight"": 1.0}, {""criterion"": ""Identifies the wrong logical operator in _merge_scopes in sentry_sdk/scope.py where or is used instead of and in if self != current_scope or self != isolation_scope, causing scope to update from self even when self is the current or isolation scope"", ""weight"": 1.0}, {""criterion"": ""Identifies the boundary condition error in add_event_processor in sentry_sdk/scope.py where >= is used instead of > in if len(self._event_processors) >= 20, causing event processors to be cleared one count earlier than intended"", ""weight"": 1.0}, {""criterion"": ""Identifies the inverted condition in capture_event in sentry_sdk/scope.py where == is used instead of != in event.get(\""type\"") == \""transaction\"", causing last_event_id to be updated only for transactions instead of errors and messages"", ""weight"": 1.0}, {""criterion"": ""Identifies the inverted comparison in strip_string in sentry_sdk/utils.py where <= is used instead of > in text_size <= max_length, causing truncation when under the limit and skipping truncation when over"", ""weight"": 1.0}, {""criterion"": ""Identifies the wrong slice in merge_stack_frames in sentry_sdk/utils.py where new_frames[:max_stack_frames] is used instead of new_frames[len(new_frames) - max_stack_frames:], causing oldest frames to be kept instead of newest"", ""weight"": 1.0}, {""criterion"": ""Identifies the off-by-one index error in datetime_from_isoformat in sentry_sdk/utils.py where value[-7] is used instead of value[-6] for the ISO timezone separator check, causing wrong character to be examined for TZ format"", ""weight"": 1.0}, {""criterion"": ""Identifies the boundary condition error in _send_request in sentry_sdk/transport.py where > is used instead of >= in response.status > 300, causing HTTP status 300 to not be treated as an error"", ""weight"": 1.0}, {""criterion"": ""Identifies the wrong index in _parse_rate_limits in sentry_sdk/transport.py where parameters[3] is used instead of parameters[4] for namespaces, causing wrong rate-limit parameter to be parsed"", ""weight"": 1.0}, {""criterion"": ""Identifies the boundary condition error in _serialize_node_impl in sentry_sdk/serializer.py where remaining_depth < 0 is used instead of remaining_depth <= 0, allowing one extra depth level before trimming"", ""weight"": 1.0}, {""criterion"": ""Identifies the boundary condition error in _serialize_node_impl in sentry_sdk/serializer.py where i > remaining_breadth is used instead of i >= remaining_breadth in the Mapping for-loop breadth limit check, including one extra item before the breadth limit"", ""weight"": 1.0}, {""criterion"": ""Identifies the boundary condition error in _SpanRecorder.add in sentry_sdk/tracing.py where len(self.spans) >= self.maxlen is used instead of len(self.spans) > self.maxlen, causing spans to be dropped when length equals maxlen instead of only when it exceeds maxlen"", ""weight"": 1.0}, {""criterion"": ""Identifies the inverted condition in _prepare_event in sentry_sdk/client.py where != is used instead of == in the assignment is_transaction = event.get(\""type\"") != \""transaction\"", inverting transaction vs error handling for lost event recording"", ""weight"": 1.0}, {""criterion"": ""Identifies the wrong scope restoration in Hub.__exit__ in sentry_sdk/hub.py where scope._current_scope.set(old_isolation_scope) is used instead of scope._isolation_scope.set(old_isolation_scope), causing isolation scope to be restored to the wrong context variable"", ""weight"": 1.0}, {""criterion"": ""Identifies the wrong increment direction in process_django_templates in sentry_sdk/integrations/django/__init__.py where i -= 1 is used instead of i += 1 before insert, causing the template frame to be inserted at the wrong position in the stack trace"", ""weight"": 1.0}, {""criterion"": ""Identifies the inverted condition in FlaskRequestExtractor.cookies in sentry_sdk/integrations/flask.py where len(v) > 1 is used instead of len(v) == 1, causing single-value cookies to not be unwrapped and multi-value cookies to be incorrectly unwrapped"", ""weight"": 1.0}, {""criterion"": ""Identifies the boundary condition error in _wrap_task_run in sentry_sdk/integrations/celery/__init__.py where len(args) >= 3 is used instead of len(args) > 1, causing task name from args[1] to be used only when 3 or more args are present"", ""weight"": 1.0}, {""criterion"": ""Identifies the inverted membership check in sentry_patched_callhandlers in sentry_sdk/integrations/logging.py where record.name in ignored_loggers is used instead of record.name not in ignored_loggers, causing only ignored loggers to be processed and others to be skipped"", ""weight"": 1.0}, {""criterion"": ""Identifies the boundary condition error in _wrap_handler in sentry_sdk/integrations/aws_lambda.py where len(aws_event) > 1 is used instead of len(aws_event) >= 1, causing single-item batch event lists to not be treated as batch"", ""weight"": 1.0}]",20,,,,,
c456da5b-6cb0-411f-891d-83a07595540c,gocsaf__csaf-02,d0383194-dbf0-4000-a8e2-8e33c6a9d60d,5,0.46599999999999997,0.69,0.38,0.38,0.13557285864065857,2026-02-25T07:29:25.758898Z,2026-02-25T07:29:25.758898Z,3,"[{""criterion"": ""File path: cmd/csaf_downloader/config.go, EnsureDefaults. Identifies the bug where RemoteValidatorPresets is reversed in place when not nil so preset order changes and cache key semantics break"", ""weight"": 1.0}, {""criterion"": ""File path: cmd/csaf_aggregator/indices.go, writeInterims. Identifies the bug where sort comparator uses Before instead of After so interim list order is ascending instead of descending"", ""weight"": 1.0}, {""criterion"": ""File path: cmd/csaf_checker/processor.go, markChecked. Identifies the bug where alreadyChecked key normalizes URL by stripping query (strings.Split(s, \""?\"")[0]) so URLs that differ only by query share the same cache entry"", ""weight"": 1.0}, {""criterion"": ""File path: cmd/csaf_aggregator/client.go, downloadJSON. Identifies the bug where defer res.Body.Close() is only in the success path so early returns (non-200 or non-JSON Content-Type) leak the response body"", ""weight"": 1.0}, {""criterion"": ""File path: cmd/csaf_downloader/forwarder.go, validationStatus.update. Identifies the bug where status is always updated so valid can overwrite invalid and downstream may see valid after a prior invalid in the same run"", ""weight"": 1.0}, {""criterion"": ""File path: cmd/csaf_aggregator/config.go, privateOpenPGPKey. Identifies the bug where early return when key or keyErr already set does not call Unlock so the mutex is held and subsequent callers deadlock"", ""weight"": 1.0}, {""criterion"": ""File path: cmd/csaf_aggregator/full.go, full. Identifies the bug where close(queue) is called before sending jobs so send on closed channel panics or workers never receive jobs"", ""weight"": 1.0}, {""criterion"": ""File path: cmd/csaf_aggregator/interim.go, checkInterims. Identifies the bug where validation errors are iterated over errList which is never assigned from errors so no validation errors are logged and invalid interim may proceed"", ""weight"": 1.0}]",8,,,,,
5c335807-25b5-4b6c-bf75-0dde826a3bf5,googlecloudplatform__osconfig-01,ed4132f3-fe0d-4916-bd99-6776c4841345,5,0.54,0.63,0.38,0.56,0.10464224768228175,2026-02-24T09:54:26.341351Z,2026-02-24T09:54:26.341351Z,4,"[{""criterion"": ""Identifies that the ResourceExhausted retry in agentendpoint/agentendpoint.go WaitForTaskNotification passes 0 instead of 5 as the extra backoff parameter to RetrySleep, removing the additional backoff for rate-limited errors"", ""weight"": 1.0}, {""criterion"": ""Identifies that filterPackages in ospatch/updates.go uses len(exclusivePackages) == 0 instead of exclusivePackages == nil, changing the semantics for empty non-nil slices so all packages pass through instead of being filtered out"", ""weight"": 1.0}, {""criterion"": ""Identifies that updatePackageInfoCache in config/package_resource.go uses Before instead of After for comparing time.Now().Add(packageInfoCacheTimeout) against v.LastLookup, inverting the cache eviction logic so fresh entries are evicted and stale entries are kept"", ""weight"": 1.0}, {""criterion"": ""Identifies that computeStableFingerprint in agentendpoint/inventory.go calls sort.Strings(entries) before the package loops populate the slice, making the sort a no-op on an empty slice and leaving the fingerprint dependent on package enumeration order"", ""weight"": 1.0}, {""criterion"": ""Identifies that createConfigFromMetadata in agentconfig/agentconfig.go processes DisabledFeatures before PreReleaseFeaturesOld and PreReleaseFeatures instead of after, allowing pre-release feature flags to override disabled features"", ""weight"": 1.0}, {""criterion"": ""Identifies that reportContinuingState in agentendpoint/patch_task.go returns nil instead of calling r.saveState() after updating lastProgressState, so the task progress state is not persisted to disk for crash recovery"", ""weight"": 1.0}, {""criterion"": ""Identifies that truncateMessage in agentendpoint/config_task.go uses size/4 instead of size/2 for the cut variable, changing the head-tail truncation ratio of error messages from 50/50 to 75/25"", ""weight"": 1.0}, {""criterion"": ""Identifies that WaitForTaskNotification in agentendpoint/agentendpoint.go does not reset the errs counter to 0 after a successful waitForTask call, causing the error count to accumulate across non-consecutive errors until it reaches 10 and the client closes"", ""weight"": 1.0}]",8,,,,,
9e5ec88d-0e96-4a06-894a-4f50df9c5d2e,graphql-hive__graphql-modules-01,78667ec2-c7d5-45b0-8653-1481073d1f3f,5,0.528,0.63,0.44,0.5,0.09628083921528728,2026-02-25T12:58:03.387237Z,2026-02-25T12:58:03.387237Z,4,"[{""criterion"": ""Identifies that dependency injection token creation logic in packages/graphql-modules/src/shared/di.ts does not ensure stable identity across injector boundaries, causing inconsistent token resolution."", ""weight"": 1.0}, {""criterion"": ""Identifies that singleton provider initialization logic placement in packages/graphql-modules/src/application/application.ts prevents guaranteed execution during application initialization lifecycle."", ""weight"": 1.0}, {""criterion"": ""Identifies that provider lookup traversal logic in packages/graphql-modules/src/di/injector.ts does not correctly enforce valid provider resolution boundaries."", ""weight"": 1.0}, {""criterion"": ""Identifies that dependency optional resolution semantics are altered in Inject decorator implementation in packages/graphql-modules/src/di/decorators.ts."", ""weight"": 1.0}, {""criterion"": ""Identifies that middleware execution normalization logic in packages/graphql-modules/src/shared/middleware.ts does not ensure consistent async execution handling."", ""weight"": 1.0}, {""criterion"": ""Identifies that module identity aggregation logic in packages/graphql-modules/src/module/types.ts initializes aggregation state inconsistently with expected module identity collection behavior."", ""weight"": 1.0}, {""criterion"": ""Identifies that global provider attachment logic in packages/graphql-modules/src/application/application.ts executes after schema construction, causing providers to be unavailable during schema initialization."", ""weight"": 1.0}, {""criterion"": ""Identifies that module identity transformation logic in packages/graphql-modules/src/application/tokens.ts does not correctly preserve transformed module identifiers."", ""weight"": 1.0}]",8,,,,,
0d64a09d-0146-4b78-881e-b41f8ddf3341,graphql-hive__graphql-modules-04,4fb7c378-7661-46e3-a0bf-c61df2c527dd,5,0.726,0.75,0.69,0.75,0.032863353450309996,2026-02-25T13:15:04.519124Z,2026-02-25T13:15:04.519124Z,5,"[{""criterion"": ""Identifies that schema builder selection logic in packages/graphql-modules/src/application/application.ts derives builder configuration from incorrect configuration scope, causing inconsistent schema construction across application factory reuse."", ""weight"": 1.0}, {""criterion"": ""Identifies that injector parent assignment logic in packages/graphql-modules/src/di/injector.ts incorrectly promotes fallback injector to primary parent under certain initialization conditions, violating injector hierarchy invariants."", ""weight"": 1.0}, {""criterion"": ""Identifies that dependency metadata resolution logic in packages/graphql-modules/src/di/decorators.ts retrieves constructor parameter metadata from incorrect reflection target, causing dependency resolution inconsistency."", ""weight"": 1.0}, {""criterion"": ""Identifies that provider identity resolution logic in packages/graphql-modules/src/di/injector.ts does not consistently preserve provider key identity across injector initialization."", ""weight"": 1.0}, {""criterion"": ""Identifies that cyclic dependency detection logic in packages/graphql-modules/src/di/injector.ts does not correctly maintain construction state invariants during provider instantiation."", ""weight"": 1.0}, {""criterion"": ""Identifies that execution context getter chaining logic in packages/graphql-modules/src/di/injector.ts allows fallback getter resolution when current getter returns undefined, causing execution context to be resolved from unintended injector."", ""weight"": 1.0}, {""criterion"": ""Identifies that provider instance caching logic in packages/graphql-modules/src/di/injector.ts stores incorrect sentinel values, affecting future provider resolution correctness."", ""weight"": 1.0}, {""criterion"": ""Identifies that provider resolution traversal logic in packages/graphql-modules/src/di/injector.ts does not consistently enforce expected provider precedence across injector hierarchy."", ""weight"": 1.0}]",8,,,,,
314205b1-d85e-47ce-a710-abad11de566d,graphql-hive__graphql-modules-04,76bcc283-5550-42f4-99a2-4e08d62ea3d3,5,0.55,0.63,0.5,0.56,0.05385164807134505,2026-02-26T13:11:10.089596Z,2026-02-26T13:11:10.089596Z,5,"[{""criterion"": ""Identifies that schema builder selection logic in packages/graphql-modules/src/application/application.ts derives schema builder configuration from the per-factory invocation configuration instead of the original application initialization configuration, causing schema construction behavior to vary across application factory reuse."", ""weight"": 1.0}, {""criterion"": ""Identifies that injector initialization logic in packages/graphql-modules/src/di/injector.ts assigns injector parent reference using fallback injector when primary parent is undefined, causing fallback injector to participate as primary resolution parent and altering intended injector hierarchy resolution."", ""weight"": 1.0}, {""criterion"": ""Identifies that dependency metadata resolution logic in packages/graphql-modules/src/di/decorators.ts retrieves constructor dependency metadata from a reflection target that does not consistently represent the declaring class constructor, causing dependency resolution inconsistency."", ""weight"": 1.0}, {""criterion"": ""Identifies that provider identity initialization in packages/graphql-modules/src/di/injector.ts derives key identifiers using Key.get(provider.key.token) when provider.key.id is not already numeric, causing provider identity to be recomputed instead of consistently preserving the original provider key identity established during provider registration."", ""weight"": 1.0}, {""criterion"": ""Identifies that provider construction state tracking logic in packages/graphql-modules/src/di/injector.ts allows provider construction state to transition out of active construction tracking before dependency resolution lifecycle is fully stabilized, weakening cyclic dependency detection."", ""weight"": 1.0}, {""criterion"": ""Identifies that execution context resolution logic in packages/graphql-modules/src/di/injector.ts allows execution context getter resolution to propagate beyond the injector instance responsible for current provider instantiation lifecycle, causing execution context ownership inconsistency."", ""weight"": 1.0}, {""criterion"": ""Identifies that provider instance caching logic in packages/graphql-modules/src/di/injector.ts stores resolution state representing failed provider lookup in the injector instance cache, preventing correct provider resolution on subsequent lookups when resolution conditions change."", ""weight"": 1.0}, {""criterion"": ""Identifies that provider resolution traversal logic in packages/graphql-modules/src/di/injector.ts allows fallback injector resolution path to participate in resolution traversal sequence in a way that alters intended provider precedence hierarchy."", ""weight"": 1.0}]",8,,,,,
b04601bc-2fc5-4ccb-a19d-d947292d02b7,guardrails-ai__guardrails-01,9d31eeb7-fd51-4e21-b3f8-edff16134eab,5,0.538,0.63,0.44,0.56,0.07155417527999328,2026-02-26T13:22:05.749259Z,2026-02-26T13:22:05.749259Z,3,"[{""criterion"": ""Identifies that guardrails/classes/rc.py RC.load passes unstripped value to to_bool for BOOL_CONFIGS keys, so trailing spaces or inline comments cause to_bool to return None"", ""weight"": 1.0}, {""criterion"": ""Identifies that guardrails/actions/reask.py get_reask_setup_for_string uses (validation_response or reasks[0]).incorrect_value, which can IndexError when reasks is empty and validation_response is None"", ""weight"": 1.0}, {""criterion"": ""Identifies that guardrails/utils/parsing_utils.py prune_extra_keys uses ancestor_is_wildcard = any(w == json_path for w in wildcards) instead of any(w in json_path for w in wildcards), causing keys under wildcard paths to be pruned incorrectly"", ""weight"": 1.0}, {""criterion"": ""Identifies that guardrails/run/runner.py Runner.__call__ uses range(max(1, self.num_reasks)) instead of range(self.num_reasks + 1), so one fewer reask iteration runs when num_reasks >= 1"", ""weight"": 1.0}, {""criterion"": ""Identifies that guardrails/merge.py in the PRESERVED/PRESERVED branch uses len(source_text) >= len(target_text) instead of len(source_text) > len(target_text), flipping tie-breaking when lengths are equal"", ""weight"": 1.0}, {""criterion"": ""Identifies that guardrails/actions/reask.py update_response_by_path uses path[:-2] instead of path[:-1] for descent, so when path has 2+ elements the value is written one level too high (e.g. root instead of nested, or wrong nested key)"", ""weight"": 1.0}, {""criterion"": ""Identifies that guardrails/run/runner.py and guardrails/run/async_runner.py validate use if not parsed_output instead of if parsed_output is None, causing empty list and empty dict to skip validation"", ""weight"": 1.0}, {""criterion"": ""Identifies wrong argument order in guardrails/validator_service/validator_service_base.py multi_merge calling merge(nextval, current, original) instead of merge(current, nextval, original)"", ""weight"": 1.0}]",8,,,,,
