job_id,problem_id,problem_uuid,num_attempts,score_mean,score_max,score_min,score_median,score_stdev,created_at_first,created_at_last,num_oscillating,rubric_json,rubric_count,download_status,status,qa_result,qa_notes,processed_at
819430c6-3df7-4775-bc17-4775b67ba92c,marshalx__yandex-music-api-01,9a213262-7f85-4e1e-96ea-da1b68f99382,5,0.48800000000000004,0.56,0.38,0.5,0.07823042886243181,2026-02-24T16:48:46.075170Z,2026-02-24T16:48:46.075170Z,4,"[{""criterion"": ""Identifies that Album.de_json() in yandex_music/album/album.py sets labels to None instead of an empty list when the labels data is in an unrecognized format, causing downstream code that iterates over album.labels to raise a TypeError because NoneType is not iterable instead of gracefully processing an empty collection."", ""weight"": 1.0}, {""criterion"": ""Identifies that rotor_station_settings2() in yandex_music/client.py changes the default language filter from 'not-russian' to 'any', causing the radio station to stream tracks in all languages instead of filtering out Russian-language content by default, which alters content curation behavior for callers relying on the original default."", ""weight"": 1.0}, {""criterion"": ""Identifies that BriefInfo.de_json() in yandex_music/artist/brief_info.py reads cover data from the key 'covers' instead of 'all_covers', causing the all_covers field to always deserialize as an empty list because the API response stores cover data under the 'all_covers' key that is never matched by the incorrect lookup."", ""weight"": 1.0}, {""criterion"": ""Identifies that Genre.de_json() in yandex_music/genre/genre.py reads sub-genre data from the key 'children' instead of 'sub_genres', causing the sub_genres field to always deserialize as an empty list because the API response stores sub-genre data under the 'sub_genres' key that is never matched by the incorrect lookup, which breaks genre hierarchy construction."", ""weight"": 1.0}, {""criterion"": ""Identifies that Status.de_json() in yandex_music/account/status.py reads station data from the key 'station' instead of 'station_data', causing the station_data field to always deserialize as None because the API response stores station information under the 'station_data' key that is never matched by the shortened key lookup, which prevents radio station metadata from being populated on the status object."", ""weight"": 1.0}, {""criterion"": ""Identifies that the __build_direct_link method in yandex_music/download_info.py uses the timestamp variable ts instead of the signature variable s when computing the MD5 hash for track download URL signing, causing all generated download links to have invalid signatures that will be rejected by the CDN server, making track downloads fail with authentication errors."", ""weight"": 1.0}, {""criterion"": ""Identifies that AutoRenewable.de_json() in yandex_music/account/auto_renewable.py reads the master_info field from the key 'master' instead of 'master_info', causing the family subscription master user data to always deserialize as None because the API response stores the master user information under the 'master_info' key that is never matched by the shortened key lookup."", ""weight"": 1.0}, {""criterion"": ""Identifies that Event.de_json() in yandex_music/feed/event.py reads album event data from the key 'album_events' instead of 'albums', causing the albums field to always deserialize as an empty list because the API response stores album event data under the 'albums' key that is never matched by the type-name-based key lookup, which breaks feed event album display."", ""weight"": 1.0}]",8,,,,,
888bf46d-2935-4d2a-a73f-abe455c322fe,matchms__matchms-01,c43b39de-404a-4939-92f1-6fc7bead7cf5,5,0.73,0.8,0.65,0.7,0.06708203932499372,2026-02-25T04:32:56.072187Z,2026-02-25T04:32:56.072187Z,3,"[{""criterion"": ""Identifies that in matchms/Pipeline.py (around line 173) the reference spectrum processor is initialized with self.__workflow['query_filters'] instead of self.__workflow['reference_filters'], so reference spectra are processed with the query filter pipeline and the two pipelines are only correct when query_filters and reference_filters happen to be identical"", ""weight"": 1.0}, {""criterion"": ""Identifies the wrong sign of mass_shift in matchms/similarity/ModifiedCosine.py (around line 114) where mass_shift is set to precursor_mz_query - precursor_mz_ref instead of precursor_mz_ref - precursor_mz_query, causing the precursor-based mass shift to be applied in the wrong direction and producing incorrect modified cosine alignment"", ""weight"": 1.0}, {""criterion"": ""Identifies the wrong cosine normalization in matchms/similarity/spectrum_similarity_functions.py (around line 111) where the score is divided by the sum of the two L2 norms instead of their product, so the denominator is (norm1 + norm2) instead of (norm1 * norm2), producing incorrect cosine similarity values that depend on spectrum scale in a non-standard way"", ""weight"": 1.0}, {""criterion"": ""Identifies the boundary condition in matchms/similarity/spectrum_similarity_functions.py (around line 80) where the break uses mz2 >= high_bound instead of mz2 > high_bound, so peaks exactly at the high tolerance boundary are excluded from matching and matching can oscillate with floating-point representation"", ""weight"": 1.0}, {""criterion"": ""Identifies the wrong ppm denominator in matchms/similarity/spectrum_similarity_functions.py (around lines 161-163) in number_matching_ppm where mean_value is set to max(number_1, number_2) instead of (number_1 + number_2)/2, violating the standard symmetric ppm definition and causing asymmetric tolerance behavior; and that (0,0) pairs are skipped"", ""weight"": 1.0}, {""criterion"": ""Identifies that in matchms/similarity/BaseSimilarity.py (around lines 145-147) keep_score for structured scores uses valuelike = False with or so that any non-zero field causes the score to be kept, allowing zero similarity scores with non-zero match counts to be stored when they should be filtered out"", ""weight"": 1.0}, {""criterion"": ""Identifies that in matchms/Fragments.py (around line 72) the mz property returns self._mz instead of self._mz.copy(), exposing the internal array to mutation and allowing callers to break the m/z sorted-order invariant and corrupt fragment state"", ""weight"": 1.0}, {""criterion"": ""Identifies the wrong mask in matchms/Spectrum.py (around lines 264-265) in compute_losses where the mask uses (peaks_mz >= loss_mz_from) & (peaks_mz <= loss_mz_to) instead of (losses_mz >= loss_mz_from) & (losses_mz <= loss_mz_to), so losses are filtered by peak m/z range instead of loss value range and the returned losses are incorrect"", ""weight"": 1.0}, {""criterion"": ""Identifies the swapped spectrum order in matchms/similarity/ModifiedCosine.py (around lines 115-117) where collect_peak_pairs is called with (spec2, spec1, ...) for nonzero_pairs instead of (spec1, spec2, ...), so the returned (idx1, idx2) pairs refer to spec2 and spec1 respectively and score_best_matches later indexes spec1 and spec2 with those indices producing wrong or out-of-bounds results"", ""weight"": 1.0}, {""criterion"": ""Identifies the wrong sort order in matchms/similarity/CosineGreedy.py (around line 94) where matching_pairs are sorted by product in ascending order instead of descending, so the greedy assignment processes low-product pairs first and produces suboptimal (lower) cosine scores instead of the intended best-match assignment"", ""weight"": 1.0}]",10,,,,,
8e2da4cb-a674-4ce1-9ee5-60b1c4b21d20,meadsteve__lagom-01,cfdfa722-bcb5-49bd-bb98-a9baa0811e10,5,0.534,0.67,0.39,0.56,0.11674759098157016,2026-02-26T17:44:45.449787Z,2026-02-26T17:44:45.449787Z,5,"[{""criterion"": ""Identifies the _define_singleton_in_new_container bug in lagom/updaters.py where container.resolve(dep, suppress_error=True) allows None to be stored as singleton when dep is undefined."", ""weight"": 1.0}, {""criterion"": ""Identifies the get_unresolvable_deps_sequence bug in lagom/exceptions.py where the loop uses range(99) instead of range(100), off-by-one reducing max dependency chain depth."", ""weight"": 1.0}, {""criterion"": ""Identifies the magic_partial bug in lagom/container.py where final_skip_pos_up_to uses min() instead of max(skip_pos_up_to, len(supplied_args)), breaking positional skip logic."", ""weight"": 1.0}, {""criterion"": ""Identifies the MissingEnvVariable.__init__ bug in lagom/exceptions.py where variable names are joined with '' instead of ', ', making the error message unreadable."", ""weight"": 1.0}, {""criterion"": ""Identifies the Singleton.__init__ bug in lagom/definitions.py where normalise(singleton_type) is called without skip_alias_definitions=True, breaking alias handling in singletons."", ""weight"": 1.0}, {""criterion"": ""Identifies the Container.__getitem__ bug in lagom/container.py where self.resolve(dep, suppress_error=True) is used instead of self.resolve(dep), so unresolved dependencies return None instead of raising."", ""weight"": 1.0}, {""criterion"": ""Identifies the UnresolvableTypeDefinition.get_instance bug in lagom/definitions.py where when _msg_or_exception is an Exception, TypeResolutionBlocked is raised instead of the original exception."", ""weight"": 1.0}, {""criterion"": ""Identifies the _reflection_build bug in lagom/container.py where type_stack.add(dep_type) is done before the circular check, so every type is reported as circular."", ""weight"": 1.0}, {""criterion"": ""Identifies the defined_types property bug in lagom/container.py where only self._registered_types.keys() is returned instead of union with parent, so parent definitions are not reported."", ""weight"": 1.0}]",9,,,,,
cf175c6c-a543-428b-9174-ebd964cfaff8,meadsteve__lagom-01,4ab58b9c-e193-4ae9-bcca-916e4bd1764d,5,0.76,0.8,0.7,0.77,0.044158804331639274,2026-02-26T15:57:50.760528Z,2026-02-26T15:57:50.760528Z,5,"[{""criterion"": ""Identifies the get_definition bug in lagom/container.py where when definition is Unset the method returns definition instead of delegating to _parent_definitions.get_definition(dep_type), so parent definitions are never found."", ""weight"": 1.0}, {""criterion"": ""Identifies the _infer_dependencies bug in lagom/container.py where the filter uses 'if dep is None' instead of 'if dep is not None', so None dependencies are included and break injection."", ""weight"": 1.0}, {""criterion"": ""Identifies the SingletonWrapper._load_instance bug in lagom/definitions.py where the condition is inverted to 'if not self._has_instance' return cached instance, so the instance is never loaded."", ""weight"": 1.0}, {""criterion"": ""Identifies the construction() bug in lagom/definitions.py where arity 0 returns ConstructionWithContainer and arity 1 returns ConstructionWithoutContainer (swapped), breaking 0-arity and 1-arity resolvers."", ""weight"": 1.0}, {""criterion"": ""Identifies the YieldWithoutContainer.get_instance bug in lagom/definitions.py where resolver(container) is called instead of resolver(), breaking 0-arity generator constructors."", ""weight"": 1.0}, {""criterion"": ""Identifies the ContextContainer.__exit__ bug in lagom/context_based.py where exit_stack.close() is never called (exit_stack set to None only), so context managers are never exited."", ""weight"": 1.0}, {""criterion"": ""Identifies the _context_type_def bug in lagom/context_based.py where Generator[None, None, dep_type] is used instead of Generator[dep_type, None, None], so the context manager type is wrong."", ""weight"": 1.0}, {""criterion"": ""Identifies the Container.clone() bug in lagom/container.py where Container() is returned instead of Container(self, ...), so the clone has no parent definitions."", ""weight"": 1.0}, {""criterion"": ""Identifies the SingletonWrapper._has_instance property bug in lagom/definitions.py where it returns self._instance is None instead of is not None, inverting the check."", ""weight"": 1.0}, {""criterion"": ""Identifies the UnresolvableType.__init__ bug in lagom/exceptions.py where self.dep_type is set to dep_type (the class) instead of _dep_type_as_string(dep_type), breaking get_unresolvable_deps_sequence."", ""weight"": 1.0}, {""criterion"": ""Identifies the get_unresolvable_deps_sequence bug in lagom/exceptions.py where the loop uses range(99) instead of range(100), off-by-one reducing max dependency chain depth."", ""weight"": 1.0}, {""criterion"": ""Identifies the Injectable.__bool__ bug in lagom/markers.py where it returns True instead of False, so injectable is truthy and breaks dependency-not-injected checks."", ""weight"": 1.0}, {""criterion"": ""Identifies the _define_singleton_in_new_container bug in lagom/updaters.py where container.resolve(dep, suppress_error=True) allows None to be stored as singleton when dep is undefined."", ""weight"": 1.0}, {""criterion"": ""Identifies the remove_optional_type bug in lagom/util/reflection.py where len(dep_type.__args__) >= 2 is used instead of == 2, so Union with more than two args is wrongly treated as Optional."", ""weight"": 1.0}, {""criterion"": ""Identifies the arity bug in lagom/util/functional.py where 1 is subtracted from the parameter count, returning wrong arity (off-by-one) for all callables."", ""weight"": 1.0}]",15,,,,,
f347ddf3-d577-4002-9c0a-d874d2baf73f,meadsteve__lagom-01,ecab44bc-018c-490d-a909-a692ca4c1eb0,5,0.638,0.7,0.6,0.63,0.03701351104664348,2026-02-26T15:57:07.504825Z,2026-02-26T15:57:07.504825Z,4,"[{""criterion"": ""Identifies the Container.__init__ bug in lagom/container.py where when container is provided, _parent_definitions is set to EmptyDefinitionSet() instead of container, so parent definitions are ignored."", ""weight"": 1.0}, {""criterion"": ""Identifies the define() bug in lagom/container.py where normalise(resolver, skip_alias_definitions=True) is always called instead of normalise(resolver), breaking alias handling."", ""weight"": 1.0}, {""criterion"": ""Identifies the _resolve bug in lagom/container.py where optional_dep_type is resolved with suppress_error=False instead of True, so Optional dependencies raise instead of returning None."", ""weight"": 1.0}, {""criterion"": ""Identifies the _reflection_build bug in lagom/container.py where types_to_skip=set() instead of {dep_type}, so the type being built can be injected into itself (infinite recursion)."", ""weight"": 1.0}, {""criterion"": ""Identifies the PlainInstance.get_instance bug in lagom/definitions.py where container.resolve(type(self.value)) is returned instead of self.value, ignoring the wrapped instance."", ""weight"": 1.0}, {""criterion"": ""Identifies the UnresolvableTypeDefinition.get_instance bug in lagom/definitions.py where when _msg_or_exception is an Exception, TypeResolutionBlocked is raised instead of the original exception."", ""weight"": 1.0}, {""criterion"": ""Identifies the normalise() bug in lagom/definitions.py where sync functions use async_construction and coroutine functions use construction (swapped), breaking definition types."", ""weight"": 1.0}, {""criterion"": ""Identifies the _context_resolver bug in lagom/context_based.py where enter_context is called twice on the same context manager, double-entering the context."", ""weight"": 1.0}, {""criterion"": ""Identifies the Container.__getitem__ bug in lagom/container.py where self.resolve(dep, suppress_error=True) is used instead of self.resolve(dep), so unresolved dependencies return None instead of raising."", ""weight"": 1.0}, {""criterion"": ""Identifies the CircularDefinitionError.__init__ bug in lagom/exceptions.py where the message uses dep_type instead of type_stack_string for 'Types being built', losing the type list."", ""weight"": 1.0}, {""criterion"": ""Identifies the DependencyNotDefined.__init__ bug in lagom/exceptions.py where the message uses dep_type (the class object) instead of _dep_type_as_string(dep_type), producing wrong message format."", ""weight"": 1.0}, {""criterion"": ""Identifies the reflect() bug in lagom/util/reflection.py where annotations.pop('result', None) is used instead of RETURN_ANNOTATION ('return'), so return type is never detected."", ""weight"": 1.0}, {""criterion"": ""Identifies the FunctionSpec.without_argument bug in lagom/util/reflection.py where the filter uses arg != arg_to_remove + 'x' instead of arg != arg_to_remove, so the argument is never removed."", ""weight"": 1.0}, {""criterion"": ""Identifies the remove_awaitable_type bug in lagom/util/reflection.py where dep_type is returned instead of dep_type.__args__[0], so the inner type is not unwrapped for Awaitable."", ""weight"": 1.0}, {""criterion"": ""Identifies the Injectable.__getattr__ bug in lagom/markers.py where the condition uses 'or' instead of 'and' (item.startswith('__') or item.endswith('__')), so non-dunder attributes like __foo skip raising."", ""weight"": 1.0}]",15,,,,,
0b476a8f-a480-40cf-8484-712e2a2d163a,meadsteve__lagom-02,9a8ccc11-6c57-4c37-8567-2aa2ee718920,5,0.5900000000000001,0.65,0.55,0.55,0.0547722557505166,2026-02-26T17:45:01.124485Z,2026-02-26T17:45:01.124485Z,5,"[{""criterion"": ""Identifies the define() bug in lagom/container.py where normalise(resolver, skip_alias_definitions=True) is always called instead of normalise(resolver), breaking alias handling."", ""weight"": 1.0}, {""criterion"": ""Identifies the DependencyNotDefined.__init__ bug in lagom/exceptions.py where the message uses dep_type (the class object) instead of _dep_type_as_string(dep_type), producing wrong message format."", ""weight"": 1.0}, {""criterion"": ""Identifies the Injectable.__getattr__ bug in lagom/markers.py where the condition uses 'or' instead of 'and' (item.startswith('__') or item.endswith('__')), so non-dunder attributes skip raising."", ""weight"": 1.0}, {""criterion"": ""Identifies the CircularDefinitionError.__init__ bug in lagom/exceptions.py where the message uses dep_type instead of type_stack_string for 'Types being built', losing the type list."", ""weight"": 1.0}, {""criterion"": ""Identifies the Alias.get_instance bug in lagom/definitions.py where skip_definitions=not self.skip_definitions is passed, inverting the skip_definitions flag."", ""weight"": 1.0}, {""criterion"": ""Identifies the UnresolvableType.__init__ bug in lagom/exceptions.py where self.dep_type is set to dep_type (the class) instead of _dep_type_as_string(dep_type), breaking get_unresolvable_deps_sequence."", ""weight"": 1.0}, {""criterion"": ""Identifies the SingletonWrapper._load_instance bug in lagom/definitions.py where the condition is inverted to 'if not self._has_instance' return cached instance, so the instance is never loaded."", ""weight"": 1.0}, {""criterion"": ""Identifies the Injectable.__bool__ bug in lagom/markers.py where it returns True instead of False, so injectable is truthy and breaks dependency-not-injected checks."", ""weight"": 1.0}, {""criterion"": ""Identifies the remove_optional_type bug in lagom/util/reflection.py where len(dep_type.__args__) >= 2 is used instead of == 2, so Union with more than two args is wrongly treated as Optional."", ""weight"": 1.0}, {""criterion"": ""Identifies the construction() bug in lagom/definitions.py where arity 0 returns ConstructionWithContainer and arity 1 returns ConstructionWithoutContainer (swapped), breaking 0-arity and 1-arity resolvers."", ""weight"": 1.0}]",10,,,,,
143fa412-1669-4c6b-a99a-6d48981135c1,meadsteve__lagom-02,5a0d63f3-6be7-4d9e-8315-6ef281034913,5,0.552,0.63,0.44,0.56,0.0828854631404084,2026-02-26T18:21:31.468509Z,2026-02-26T18:21:31.468509Z,5,"[{""criterion"": ""Identifies the define() bug in lagom/container.py where normalise(resolver, skip_alias_definitions=True) is always called instead of normalise(resolver), breaking alias handling."", ""weight"": 1.0}, {""criterion"": ""Identifies the DependencyNotDefined.__init__ bug in lagom/exceptions.py where the message uses dep_type (the class object) instead of _dep_type_as_string(dep_type), producing wrong message format."", ""weight"": 1.0}, {""criterion"": ""Identifies the Injectable.__getattr__ bug in lagom/markers.py where the condition uses 'or' instead of 'and' (item.startswith('__') or item.endswith('__')), so non-dunder attributes skip raising."", ""weight"": 1.0}, {""criterion"": ""Identifies the CircularDefinitionError.__init__ bug in lagom/exceptions.py where the message uses dep_type instead of type_stack_string for 'Types being built', losing the type list."", ""weight"": 1.0}, {""criterion"": ""Identifies the Alias.get_instance bug in lagom/definitions.py where skip_definitions=not self.skip_definitions is passed, inverting the skip_definitions flag."", ""weight"": 1.0}, {""criterion"": ""Identifies the UnresolvableType.__init__ bug in lagom/exceptions.py where self.dep_type is set to dep_type (the class) instead of _dep_type_as_string(dep_type), breaking get_unresolvable_deps_sequence."", ""weight"": 1.0}, {""criterion"": ""Identifies the Injectable.__bool__ bug in lagom/markers.py where it returns True instead of False, so injectable is truthy and breaks dependency-not-injected checks."", ""weight"": 1.0}, {""criterion"": ""Identifies the remove_optional_type bug in lagom/util/reflection.py where len(dep_type.__args__) >= 2 is used instead of == 2, so Union with more than two args is wrongly treated as Optional."", ""weight"": 1.0}]",8,,,,,
7e32944b-02a4-436c-9b4b-5f8860ee5050,microsoft__trace-02,1e35dfa1-073e-4264-ac62-a1bbd79f7133,5,0.75,0.81,0.63,0.75,0.07348469228349536,2026-02-25T18:19:25.586727Z,2026-02-25T18:19:25.586727Z,3,"[{""criterion"": ""Identifies the key collision or key-type inconsistency in Map.parameters_dict in opto/trace/containers.py where value ParameterNodes are keyed by str(v) instead of k, causing overwrites or inconsistent parameter keys."", ""weight"": 1.0}, {""criterion"": ""Identifies the missing maxsplit in Graph.get in opto/trace/nodes.py where name.split(\"":\"") is used and first/last part are used for key and id, so names with multiple colons resolve to the wrong key or index."", ""weight"": 1.0}, {""criterion"": ""Identifies the missing clamp in generate_comment in FunModule in opto/trace/bundle.py where comment_line_number - base_line_number can be negative, so the comment is attached to the wrong line (from the end of the source)."", ""weight"": 1.0}, {""criterion"": ""Identifies the wrong slice in repr_function_call in opto/optimizers/optoprime.py when child.inputs is empty, where [:-2] removes \""(\"" so the result is \""name = fun)\"" instead of \""name = fun()\""."", ""weight"": 1.0}, {""criterion"": ""Identifies that in repr_node_value in opto/optimizers/optoprime.py non-code entries are formatted as k=v[0] (equals) while __code entries are formatted as k:v[0] (colon, no space), so downstream parsing that expects uniform key=value format fails on __code keys."", ""weight"": 1.0}, {""criterion"": ""Identifies that the id property on AbstractNode in opto/trace/nodes.py uses return self.name.split(\"":\"")[1] without maxsplit, so the returned identifier is only the segment after the first colon (e.g. name \""a:b:0\"" would yield id \""b:0\"" instead of the intended \""0\"")."", ""weight"": 1.0}, {""criterion"": ""Identifies the key namespace collision in Seq.parameters_dict in opto/trace/containers.py where ParameterNode and ParameterContainer keys can collide when attr.name equals str(attr) for another item, or when str(attr) is used for both and overwrites."", ""weight"": 1.0}, {""criterion"": ""Identifies that in Graph.clear in opto/trace/nodes.py the reassignment self._nodes = defaultdict(list) is missing (only the loop for node in self._nodes.values(): del node remains), so self._nodes is never cleared and subsequent register() appends to existing lists, producing wrong or duplicate name indices."", ""weight"": 1.0}]",8,,,,,
